Titulo,Resumen,Autor,Fecha,Noticia,Keywords,URL,Categoria
"Malaria, una enfermedad que sigue al acecho","El paludismo, como también es conocida esta afección, es causado por un parásito que se trasmite a los humanos a través de la picadura de mosquitos Anofeles.",J. Barrera,"Nov 25, 2023- 16:03","El Salvador está libre de malaria desde 2021, así lo ha certificado la Organización Mundial de la Salud (OMS), quien, además, ha reconocido las acciones que se realizan en el país para contrarrestar esta enfermedad. De esta manera “El Pulgarcito de América” se convirtió en la primera nación de Centroamérica, y la tercera de Latinoamérica, en quedar libre de esa enfermedad.La OMS otorga la certificación de la eliminación del paludismo, como también es conocida esa afección, cuando un país ha demostrado que se ha interrumpido la cadena de transmisión autóctona en todo su territorio durante al menos los tres años consecutivos anteriores.Sin embargo, aunque El Salvador cuenta con esa certificación, las amenazas de esa enfermedad siguen latentes, ya que en la región aún hay países que presentan casos, incluso en algunos de ellos se ha visto un incremento de pacientes con este problema de salud en los últimos meses.   LEE TAMBIÉN: Cuatro poderosas bebidas naturales para nivelar el colesterolPero, ¿qué es la malaria? Es una enfermedad causada por un parásito que se trasmite a los humanos a través de la picadura de mosquitos Anofeles infectados.“La malaria es causada por un parásito unicelular del género Plasmodium. Por lo general, el parásito se transmite a los seres humanos por las picaduras de mosquito”, informa Clínica Mayo en su sitio web.Los síntomas más comunes son fiebre, escalofríos, sensación general de malestar, dolor de cabeza, náuseas y vómitos, diarrea, dolor abdominal, dolor muscular o articular, fatiga, respiración rápida, frecuencia cardíaca acelerada y tos.   Algunas personas con malaria experimentan ciclos de ""ataque"" de malaria. Estos suelen comenzar con temblores y escalofríos, seguidos de fiebre alta, sudoración y un regreso a la temperatura normal.“Los signos y síntomas de la malaria por lo general aparecen unas pocas semanas después de que lo haya picado un mosquito infectado. Sin embargo, algunos tipos de parásitos de malaria pueden permanecer latentes en el cuerpo hasta por un año”, señala Clínica Mayo.La fiebre es uno de los síntomas más comunes de la malaria. Foto: ShutterstockSi bien la malaria es poco común en climas templados, sigue siendo común en países tropicales y subtropicales. Cada año, cerca de 290 millones de personas se infectan con esta enfermada y más de 400, 000 mueren por la afección, según reporta la OMS.   Para reducir las infecciones, los programas de salud mundiales distribuyen medicamentos preventivos y mosquiteros para cama con insecticida para proteger a las personas de las picaduras de mosquitos. La OMS recomendó una vacuna contra la malaria para los niños que viven en países con un elevado número de casos de esta enfermedad.Para evitar la enfermedad mientras se viaja, se recomienda usar ropa con protección, mosquiteros para cama e insecticidas.También puedes tomar medicamentos de prevención antes, durante y después de un viaje a una zona de riesgo alto. Muchos parásitos de la malaria desarrollaron resistencia a los medicamentos comunes que se usan para tratar la enfermedad”, refiere Clínica Mayo.En varios países está disponible la vacuna contra la malaria. Foto: ShutterstockCiclo de transmisión   Esta afección se propaga cuando un mosquito se infecta con la enfermedad después de picar a una persona infectada, y ese insecto luego pica a una persona no infectada. Los parásitos de la malaria entran en el torrente sanguíneo de esa persona y se desplazan al hígado. Cuando los parásitos maduran, dejan el hígado e infectan los glóbulos rojos.De acuerdo con información de Clínica Mayo, debido a que los parásitos que causan la malaria afectan los glóbulos rojos, las personas también pueden contraer la enfermedad por la exposición a sangre infectada; esto incluye de la madre al bebé no nacido, mediante una transfusión sanguínea o al compartir agujas utilizadas para inyectarse drogas.Especialistas en salud señalan que las personas con mayor riesgo de contraer la malaria son niños pequeños y bebés, adultos mayores, personas que viajan a países con muchísimos casos de malaria y embarazadas.   El mayor factor de riesgo para la malaria es vivir en zonas donde la enfermedad es común o visitar esas zonas, entre las que se incluyen las regiones tropicales y subtropicales de África subsahariana, el sur y sudeste asiático, las islas del Pacífico, América Central y el norte de América del Sur.El grado de riesgo depende del control local de la malaria, de los cambios estacionales en la tasa de infecciones y de las precauciones que tomes para evitar las picaduras de mosquito.TE INTERESARÁ: Carao, una fruta beneficiosa para tu saludLos residentes de una región donde hay malaria quizás se vean expuestos a la enfermedad con tanta frecuencia que adquieren una inmunidad parcial, lo que puede reducir la intensidad de los síntomas. Pero esta inmunidad parcial puede desaparecer si se muda a una zona donde ya no está expuesto frecuentemente al parásito.Según World Health, el mejor tratamiento disponible, especialmente para la malaria causada por P. falciparum, son las politerapias con artemisinina. El objetivo principal de este tratamiento es curar la infección mediante la eliminación rápida y total de los parásitos Plasmodium del torrente sanguíneo del paciente.Este y otros tipos de tratamientos deben ser determinados por un médico.La malaria puede producir una disminución de glóbulos rojos. Foto: ShutterstockPon mucha atenciónSi viajas a zonas donde el paludismo es común debes tomar medidas para reducir el riesgo de picaduras de mosquito. Estos insectos están activos entre el atardecer y el amanecer. Para protegerte de las picaduras de mosquito, debes hacer lo siguiente:Cúbrete la piel. Usa pantalones largos y camisas de manga larga. Mete la camisa en el pantalón y los pantalones en los calcetines.Aplícate repelente de insectos en la piel. Usa un repelente de insectos, especialmente los que contienen dietiltoluamida, picaridina, IR3535, aceite de eucalipto de limón, para-mentano-3,8-diol o 2-undecanona. No uses un rociador directamente en la cara.Usa repelente en la ropa. Los rociadores que tienen permetrina son seguros para la ropa.Usa mosquitero para dormir. Estas redes, sobre todo las que tienen insecticidas como la permetrina, ayudan a prevenir las picaduras de mosquito cuando duermes.Medicina preventiva. Si planeas viajar a lugares donde la malaria es común, consulta al médico unos meses antes del viaje sobre medicamentos que puedas tomar antes, durante y después del viaje, que puedan ayudar a protegerte de los parásitos de la malaria.LEE: Síntomas de cáncer de mama que no son bultosComplicacionesLa malaria puede ser fatal, en particular cuando proviene de la especie Plasmodium, común en África. La Organización Mundial de la Salud estima que alrededor del 94 por ciento de las muertes causadas por esta enfermedad ocurren en África, en la mayoría de los casos en niños menores de cinco años.Por lo general, las muertes por malaria se relacionan con una o más complicaciones graves, entre las que se incluyen las siguientes.Malaria cerebral. Si las células sanguíneas infectadas de parásitos obstruyen los pequeños vasos sanguíneos del cerebro. Puede ocurrir una inflamación del cerebro o un daño cerebral. Este tipo  puede provocar convulsiones y coma.Problemas respiratorios. El líquido acumulado en los pulmones (edema pulmonar) puede dificultar la respiración.Insuficiencia orgánica. La malaria puede dañar los riñones o el hígado, o causar la rotura del bazo. Todas estas afecciones pueden ser mortales.Anemia. La malaria puede generar que la cantidad de glóbulos rojos no sea suficiente para una provisión adecuada de oxígeno a los tejidos del cuerpo.Nivel bajo de glucosa sanguínea. En su estado más grave, la malaria puede provocar un nivel bajo de glucosa sanguínea (hipoglucemia) Esto puede provocar un coma o la muerte.REGRESAR A LA PORTADA    MÁS SOBRE ESTE TEMA ¿Por qué deberías reducir el uso excesivo del celular?  5 señales de que estás consumiendo mucha azúcar  ¿Cómo ponerle fin a los uñeros? Estos remedios caseros te ayudarán a aliviarlos KEYWORDS  Enfermedades   Malaria   OMS   Salud   Trends   Vida  Ver Comentarios","[' Enfermedades ', ' Malaria ', ' OMS ', ' Salud ', ' Trends ', ' Vida ']",https://www.elsalvador.com/vida/salud/malaria-enfermedad-sigue-al-acecho/1106432/2023/,salud
Conoce los cuidados que debe tener tu mascota en tu hogar,"Es necesario estar siempre al tanto de su crecimiento, sus emociones y su salud, pues al igual que cualquier persona, ellos sienten y padecen, así que necesitarán de la ayuda de su cuidador cuando se sientan enfermos.",Óscar Orellana,"Oct 23, 2023- 16:18","Tener mascotas en el hogar es una responsabilidad muy grande, pero no imposible. Solo es cuestión de saber cómo cuidarlos, protegerlos y velar por su salud.Una de las principales reglas es tratarlos como uno más de la familia, darles cariño, consentirlos y educarlos muy bien para evitar que sean mal portados.Asimismo, es necesario estar siempre al tanto de su crecimiento, sus emociones y su salud, pues al igual que cualquier persona, ellos sienten y padecen, así que necesitarán de la ayuda de su cuidador cuando se sientan enfermos.Por lo tanto, te presentamos algunos consejos para que cuides de la mejor manera a tu mascota.Proporciona un ambiente seguroTu hogar debe ser un lugar seguro para ellos, por lo tanto, aleja las sustancias tóxicas y todo lo que le pueda provocar un daño a su salud.  Lo ideal es proporcionar un espacio limpio y cómodo para que ellos puedan vivir y desarrollarse.   Sal de paseo con ellosSi sales a dar un paseo con tus cachorros, llévalos siempre con sus correas, y aléjalos de otros caninos que pueden ser agresivos. No olvides las bolsas para recoger sus heces, si en dado caso se hacen en la calle o en el parque. Proporciona suficiente tiempo de juego y ejercicio para liberar sus energías y evitar comportamientos no deseados.¿Vas a adoptar una mascota?Adoptar una mascota es un compromiso a largo plazo. Prepárate para cuidarla y amarla durante toda su vida, pues será un miembro más de la familia que necesitará de mucha protección. Esta depositará toda su confianza en ti, no lo traiciones ni los abandones.Perros y gatos tienen en su saliva una diversidad de seres microscópicos que pueden afectar la salud de las personas. Foto de referencia / ShutterstockEsteriliza o castra a tu mascota   Si tu mascota no está esterilizada o castrada, planifica hacerlo lo antes posible para prevenir la sobrepoblación de animales, así también puedes mejorar la salud de ellos.Socialización tempranaEs necesario que desde pequeño reciba una excelente educación. Por lo tanto, recompensa el comportamiento deseado. Premia a tu mascota con caricias o galletas. Expone a tus mascotas a diferentes personas, lugares y situaciones desde pequeño. Esto previene problemas de comportamiento relacionado con la agresión.Tonos de vozSegún el Instituto de Bienestar Animal, un tono de voz firme puede indicarle al perro que obedezca. Los perros suelen responder a ese tipo de tono con atención y respeto. Sin embargo, es importante no ser excesivamente agresivo o amenazante, ya que esto puede generar miedo y ansiedad en ellos.   PODRÍAS ESTAR COMETIENDO MALTRATO ANIMAL SIN SABERLOLa Ley Especial de Protección y Bienestar Animal en su título cuarto establece los tipos de infracciones que podrías estar cometiendo sin saberlo. También en sus artículos 61,62, 63 y 64 clasifica estas faltas en leves, graves y muy graves.Faltas leves:No tener identificada a tu mascota. Compra y venta de animales con menos de 45 días de nacidos. Esta falta será sancionada con entre uno y tres salarios mínimos del sector comercio y servicios.Faltas graves:Transportar animales de forma inadecuada. No vacunarlos. Esta falta será sancionada con multas de entre cuatro y seis salarios mínimos.   Faltas muy graves:No rehabilitar a los perros agresivos. Abandonar animales en la vía pública o en un bien inmueble. Esta falta recibe multas entre siete y 10 salarios mínimos.LENGUAJE CORPORALCola:Según la posición y el movimiento de la cola del perrito pueden indicar su estado de ánimo. Es así como una cola erguida y en movimiento significa alegría, pero si su cola está baja y entre sus patas puede ser miedo o sumisión.Orejas:Al igual que su cola, las orejas indican su estado de ánimo. Las orejas hacia adelante significan interés o curiosidad, al contrario de las orejas hacia atrás que indican miedo o sumisión.   OjosLos ojos abiertos y relajados pueden ser calma, mientras que los ojos entrecerrados pueden indicar desconfianza o incomodidad. Por su parte, las pupilas dilatadas significan emoción y miedo.    KEYWORDS  Gatos   Perros   Salud   Trends  Ver Comentarios","[' Gatos ', ' Perros ', ' Salud ', ' Trends ']",https://www.elsalvador.com/vida/salud/conoce-los-cuidados-que-debes-tener-tu-mascota-hogar/1098685/2023/,salud
Las cucarachas invaden tu casa: combátelas con laurel,"Las odiadas cucarachas no se resisten a ciertos productos caseros y uno de esos es el aromático laurel, con este podés combatirlas de varias formas",T. Estrada,"Oct 15, 2023- 07:41","Existen una diversidad de repelentes caseros que resultan sumamente efectivos para combatir a las repugnantes cucarachas.Si eres de las que están conscientes de que existen ciertos errores domésticos que atraen a estos bichos y los evitas pero siempre aparecen, el laurel podría ser la solución.La revista colombiana Semana publicó en su sitio web varios tips que te ayudarán a contrarrestar a las cucas y liberar tu hogar de su presencia.Te puede interesar: 10 usos ‘inusuales’ del mentol que no te imaginabas y querrás intentarlos todosEstos insectos son muy difíciles de erradicar por la forma en que se reproducen y también, porque suelen aparecer en horas nocturnas.   Pero nada es imposible en esta vida, solo evitar la muerte. Por ello, trata de mantener limpio tu hogar, libre de migajas y restos de comida; sella grietas en paredes, puertas y ventanas para evitar que entren; evita la humedad y acumulación de agua, porque estos insectos también la necesitan para estar activas; y guarda los alimentos en depósitos herméticos.Hay que destacar, que los pesticidas naturales resultan efectivos por su composición y aroma, mismo que los bichos repelen. La nota antes referida destaca las bondades del laurel contra las cucarachas, porque posee compuestos volátiles como el eucaliptol que las cucas detestan.Hojas de laurel frescas. Foto: ShutterstockY acá te detallamos las cuatro formas que Semana propone para aprovechar los beneficios de esta especia contra estos indeseables bichos.   1. Bolsas con hojas secasUna de las opciones es colocar un poco de hojas secas de laurel dentro de una bolsita de tela, de esas que se ocupan para regalar dulces en bodas y comuniones. Luego, las colocas en los lugares como armarios, gavetas, despensa u otros rincones acechados por las cucas.Lee también: Eliminar las manchas amarillentas de tu ropa sí es posible2. Aceite esencialEste lo puedes adquirir fácilmente en el mercado. Mezcla unas gotitas con agua y rocía la mezcla en zonas que atraen estos insectos. La clave para que sea efectivo es la calidad del aceite esencial que compres. Asegúrate que sea del mejor.   3. Distribuye hojasLa forma más fácil de usar el laurel en esta constante lucha contra la infestación de cucas es colocar hojas secas de laurel en los lugares en los que sueles encontrarlas o en esos rincones que tú sabes que les atraen.Foto de referencia de aceite esencial de laurel: Shutterstock4. Quemar las hojasNo tiene que ser un puñado tan grande de hojas secas, pueden ser unas cuantas. Quémalas y deja que el humo aromático se extienda por tu casa. Esto provocará que las cucas salgan de sus escondites y busquen escapar. Pero para hacerlo, toma las medidas de precaución que se requieran.   REGRESAR A LA PORTADA    MÁS SOBRE ESTE TEMA ¡NO la aplastes! Cuidado con las cucarachas con las patas hacia arriba  ¿Cómo acabar con las cucarachas? Cinco descuidos en casa que las atraen  Ratas y cucarachas sobrevivirían al holocausto nuclear KEYWORDS  Cucarachas   Estilo De Vida   Plantas   Salud   Tips De Limpieza   Trends  Ver Comentarios","[' Cucarachas ', ' Estilo De Vida ', ' Plantas ', ' Salud ', ' Tips De Limpieza ', ' Trends ']",https://www.elsalvador.com/vida/salud/estilo-de-vida-cucarachas-tips-limpieza-plantas-salud/1096741/2023/,salud
Consejos para practicar el autocuidado emocional,"La salud mental es importante en todas las etapas de la vida, desde la niñez hasta la adultez. Por eso, es fundamental que pongas en práctica estos consejos de autocuidado emocional.",Óscar Orellana,"Oct 12, 2023- 14:18","Con el objetivo de crear conciencia sobre su importancia y cómo las acciones pueden contribuir a un mundo mejor, el pasado 10 de octubre se celebró el Día Mundial de la Salud Mental, un tema que ha tomado relevancia en los últimos años y al cual hay que ponerle mucha atención.La salud mental se refiere al bienestar emocional, psicológico y social de las personas, y que muchas veces suele verse afectada por la forma en que pensamos, sentimos y actuamos cuando enfrentamos diversas dificultades de la vida.Según el sitio web Medline Plus, la salud mental es importante en todas las etapas de la vida, desde la niñez y la adolescencia hasta la adultez y la vejez.Cuando una persona no se encuentra emocionalmente bien, suele verse en la forma de cómo maneja sus problemas, el estrés y la relación que tiene con otras personas.   Por eso es tan importante que practiques el autocuidado emocional, pues es una forma poderosa de recordarte a ti misma que eres valiosa y mereces ser feliz.Cultivar el amor propio debe ser una de las cosas primordiales para todas las personas cada día. Recuerda que, si tu salud mental está deteriorada, también lo estará tu salud física, así que no permitas que esto pase.También lee: ¡Llegó la temporada de la pitahaya!, ¿por qué debes consumirla?No pases mucho tiempo en tu celular. Foto/ Instagram“El autocuidado emocional es una práctica que ayuda a mantener la salud mental y el bienestar de una persona en este mundo cada vez más agitado. A medida que van surgiendo desafíos y demandas, es importante dedicar parte del tiempo a cuidar las emociones y recuperar el equilibrio perdido”, detalló el sitio web cepsicologia.com.   Esta es una práctica consciente y activa que te permite prestar atención a tus emociones, entenderlas y gestionarlas de manera saludable. Lo mejor de todo es que te permite reconocerlas y validarlas sin juicios negativos.“El objetivo principal de este autocuidado es alcanzar un equilibrio emocional que evolucione hacia una vida más plena. A veces, es común que esta práctica se subestime, ya que muchas personas lo ven como un símbolo egoísta o poco útil. Pero muchas de ellas desconocen que no poner atención a las emociones tiene graves repercusiones sobre la salud”, agregó el artículo de cepsicologia.com.Por lo tanto, es importante que le pongas mucha atención a tu salud mental, pues, de lo contrario, afectara a tu calidad de vida y a las relaciones que tengas con los que te rodean. No importa lo que te digan, nunca reprimas tus emociones, ya que corres el riesgo de acumular estrés y ansiedad, algo que puede desarrollarte problemas de salud mental a largo plazo.   También te puede interesar: El Nobel de Medicina para los pioneros de las vacunas de ARN mensajero contra el covidCuando se realiza una rutina de ejercicios, se liberan una serie de hormonas y neurotransmisores que ayuda a experimentar una sensación de tranquilidad y alivio del estrés.Acá te damos algunos consejos para practicar el autocuidado emocional que sin duda alguna te ayudarán a mejorar tu vida.   ¿Por qué es importante practicarlo?Practicar el autocuidado emocional te permitirá fortalecer tu resiliencia y la capacidad para afrontar los desafíos de manera segura y plena. Si la ejerces en tu día a día, verás que también mejorará tu productividad, creatividad y habilidad para tomar decisiones acertadas.Piensa en tiVivimos diariamente pensando en qué dirán los demás de nosotros, pero nunca le ponemos atención a lo que verdaderamente queremos. Por lo tanto, tómate un par de minutos y enfócate en el presente, evalúa tus pensamientos y emociones sin juzgarte. Esta práctica puede reducir la ansiedad y mejorar la claridad mental.No te reprimasNo exteriorizar lo que pensamos o sentimos es peligroso porque afectamos nuestra mente. Por ello, busca una manera cómoda y segura para expresar tus emociones, ya sea a través del arte, la escritura o charlando con amigos.   Enfócate en las soluciones“Ante un problema se suelen sentir emociones nada placenteras y desafiantes, pero es normal. Sin embargo, estancarse en el problema no ayuda, al contrario, canalizar las emociones para buscar soluciones y alternativas sería focalizarse en el autocuidado”, insta el Centro de Estudios de Psicología en su sitio web cepsicologia.com.Cuida tu cuerpoEs bien sabido que la conexión entre mente y cuerpo es muy fuerte. Si tu mente no está bien, tampoco lo estará tu cuerpo. Así que cuida el bienestar físico con una dieta equilibrada, ejercicio regular y descanso adecuado.Busca actividades placenterasDedica tiempo a actividades que te brinden alegría y satisfacción. No le des cabida a los pensamientos negativos, ni tampoco te encierres en las cuatro paredes de tu casa. Al contrario, aprovecha a pasar tiempo con tu familia, vete a caminar a un parque, por un helado o a ver una película. Haz lo que tanta amas.DuermeMantén una rutina de sueño excelente. No te desveles, trata de dormir las ocho horas estipuladas para que tu cuerpo pueda descansar y reponerse de una semana ajetreada.No pases clavada en tu celular Deja el celular por unas horas, aléjate de los malos hábitos y mejor reserva tiempo de calidad para realizar actividades que disfrutes y te hagan sentir bien. Desconéctate del internet y conecta con el mundo real.Practica la meditaciónLa meditación puede producir un estado de relajamiento profundo y una mente tranquila. Durante el momento, concentras tu atención y eliminas el flujo de pensamientos confusos que pueden estar llenando tu mente y provocándote estrés.Busca ayuda cuando la necesites.No dudes en buscar ayuda de un especialista cuando notes o sientas cambios significativos en tu estado de ánimo o cuando no puedas manejar una situación. Nunca te reprimas, ni mucho menos escondas tus sentimientos.    MÁS SOBRE ESTE TEMA Diez frutas ricas en nutrientes que hidratan el organismo  Estrías: 4 efectivas mascarillas para eliminarlas o prevenirlas KEYWORDS  Ansiedad   Consejos   Depresión   Estado De Salud   Salud Mental   Trends  Ver Comentarios","[' Ansiedad ', ' Consejos ', ' Depresión ', ' Estado De Salud ', ' Salud Mental ', ' Trends ']",https://www.elsalvador.com/vida/salud/consejos-practicar-autocuidado-emocional-ansiedad-depresion/1096145/2023/,salud
