Titulo,Resumen,Autor,Fecha,Noticia,Keywords,URL,Categoria
Un Black Friday con menos afluencia por el alto costo de la vida,La concurrencia a los centros comerciales del país fue menor a la de años anteriores para Black Friday. Comprar alimentos esenciales y pagar servicios acapara un porcentaje demasiado alto del salario de los salvadoreños. La Defensoría del Consumidor comprobó que la gran mayoría de comercios cumplen con las ofertas publicitadas.,Moisés Alvarado,"Nov 24, 2023- 17:37","El Black Friday de 2023 estuvo marcado, además de por descuentos, por una bajada en el poder adquisitivo de las familias salvadoreñas. Esto tuvo su expresión visual en una afluencia no tan grande en los centros comerciales del país. Metrocentro San Salvador, el icono local de estos sitios, fue un elocuente ejemplo. Abrió sus puertas a las 5 de la mañana.Hubo familias que llegaron desde la madrugada para estar entre los primeros en adquirir las mejores ofertas. Álex Mariona estaba en el sitio desde una hora antes de que se habilitara el acceso. La sonrisa bajo el bigote y la gorra era notoria, pues, dijo, logró comprar varios pares de zapatos a mitad de precio.Alex Mariona llego a las 4 am para hacer cola. Él comentó que logró comprar varios pares de zapato a mitad de precio Foto EDH/ Francisco RubioEn los locales, el cartel más común era el que marcaba el 40 % de descuento. Otras tiendas, sobre todo las zapatería, ofrecían ofertas escalonadas. Por ejemplo, el primer par a 30 % menos; el segundo al 50%; el tercero al 70. Por eso, no sorprendía que la bolsa negra de MD, que fue una de las que implementó esta modalidad, se repitiera más entre aquellas personas que llevaban más bultos.LEA MÁS: Centros comerciales están listos para un nuevo y extendido Black FridayCarlos Arévalo afirma que el Black Friday se ha convertido en su día específico para adquirir productos que no están entre aquellos de primera necesidad, como los electrónicos. Por eso, dice, ahorra durante todo el año para poder hacer compras al contado que no aumenten sus deudas.Claudia ayuda a su esposo Francisco a medirse un par de zapatos. Foto EDH/ Francisco Rubio“Es una cuestión de disciplina, no es que uno tenga eso allí disponible solo para venir a gastar. Son compras en las que hemos pensado mucho”, comenta, mientras mira a su acompañante, que junto a él cuida varias bolsas de Almacenes Siman. Y ahorrar ha sido una tarea difícil todo este año.Según afirma, en 2022 ocupaba un promedio de $100 cada 15 días solo para adquirir comida. Esa cifra se ha duplicado este año: ha llegado a gastar $200 o $250 en el mercado solo por lo más básico.Lo expresado por Arévalo se condice con las cifras oficiales: La canasta básica urbana pasó de costar $213.43 en enero de 2022 a $257.81 en octubre de 2023. Es decir que los salvadoreños deben destinar casi $45 dólares más solo en alimentos esenciales en apenas 22 meses.“Sí, se mira menos afluencia que el año pasado. Creo que es porque la gente no tiene, en este momento, para andar gastando más que en lo estrictamente necesario”, dice Arévalo.Leonardo Nolasco espera mientras sus familiares hacen fila para reclamar sus premios, obtenidos gracias a compras mayores a los 25 dólares. Son promocionales de marcas patrocinadoras, como Tigo. Se queja porque no encontró todas las promociones que esperaba, aunque sí algunas, sobre todo en ropa y zapatos. También es otro de los afectados por el aumento del costo de la vida.“Aprovechamos de venir ahora porque así nos ahorramos algunas fichitas, que, en estos tiempos, no caen mal”, comenta.El concejal de Chalatenango, Joel Aguilar busca la manera de que entren en su baúl los 300 pares de zapatos que compró durante el Black Friday. Él comentó que lleva los zapatos para revenderlos en su negocio en Nueva Concepción, Chalatenango. Foto EDH/ Francisco RubioEl salvadoreño promedio ha tenido que ir ajustando sus ingresos al aumento de gastos. Algunos, por ejemplo, han modificado su dieta, sacando del presupuesto los alimentos de mayor valor. En este grupo se encuentran, sobre todo, los compuestos en su mayoría de proteínas, que tienen origen animal.Según datos recogidos por el no gubernamental Centro para la Defensa del Consumidor, los salvadoreños han dejado de consumir carne de res en un 75.3 %; 40.3 %, en el tema del pollo; 32.2 %, respecto a los huevos; y el 23 % ya no come lácteos. La dieta ahora la conforman, sobre todo, opciones ricas en carbohidratos, que son más baratas.Las tiendas hicieron su mayor esfuerzo para ofrecer precios bajos a sus clientes. Para Julio González, vendedor en una tienda de Omnisport, el día había estado ajetreado desde temprano, pues las personas comenzaron a llegar apenas abrieron sus puertas. Este viernes vendió mucho más que cualquier otro día del 2023. Los clientes aumentaron, al menos en comparación con un día normal de fin de semana.Y Metrocentro San Salvador estuvo listo para recibirlos con estilo, con sus kioskos de café y galletas gratis y su variada oferta de entretenimiento en vivo, que incluyó a artistas salvadoreños como Gaby Tobar, Rocío Cáceres, Florence Umaña y Carlos Ruano.Respeto en las ofertasSegún publicó la Defensoría del Consumidor en sus redes sociales, esta semana realizaron 137 inspectorías en diversos comercios a escala nacional.La tónica es una de cumplimiento: casi el 94 % de los locales aprobó los diferentes criterios evaluados, como contar con precios acordes a los que ofrecía en la publicidad, ofertas reales y “buenas prácticas hacia los consumidores”.Por tanto, solo en el 6 % de los casos se activó un proceso sancionador. El sector con más faltas fue el de las ópticas (4), seguido por almacenes (3). A una tienda de tecnología y a un restaurante también se les encontraron hallazgos.En Metrocentro, la entidad contó ayer con un kiosko de atención al usuario. Según las técnicas que se encontraban en el lugar, su función era responder de manera automática ante las quejas. La idea es que todas las advertencias de clientes insatisfechos se transformaran en inspecciones a los negocios.Los mostradores de los locales lucen aglomerados de personas. Foto EDH/ Francisco RubioVOLVER A LA PORTADA    MÁS SOBRE ESTE TEMA Centros comerciales están listos para un nuevo y extendido Black Friday  Salvadoreños buscan las mejores ofertas en Black Friday  Gobierno anuncia operativo especial por Black Friday y concierto de Bad Bunny KEYWORDS  Black Friday   Comercio   El Salvador   Negocios   Pobreza  Ver Comentarios","[' Black Friday ', ' Comercio ', ' El Salvador ', ' Negocios ', ' Pobreza ']",https://www.elsalvador.com/noticias/negocios/black-friday-el-salvador-pobreza-comercio/1106338/2023/,negocios
"Gobierno eleva a más de $9,000 millones la deuda de pensiones","La nueva deuda previsional que se comenzó a acumular desde abril de este año asciende hasta septiembre a $613.1 millones, emitida por el Instituto Salvadoreño de Pensiones (ISP).",Katlen Urquilla,"Nov 23, 2023- 21:42","Pese a que el gobierno actual argumentó que tras la reforma de pensiones no se tocarían más los ahorros de los trabajadores porque la nueva ley lo prohibía, lo cierto es que continúa tomando fondos prestados de los ahorros de los cotizantes en las AFP.Mediante la figura de Certificados de Obligaciones Previsionales (COP), el Instituto Salvadoreño de Pensiones (ISP) ha emitido nueva deuda de pensiones por $613.13 millones a septiembre de este año.Estos certificados han sido adquiridos por las Administradoras de Fondos de Pensiones (AFP) con dinero ahorrado mes a mes por los trabajadores y el gobierno usa esos recursos para pagar a los pensionados.Esta nueva deuda se suma a la que tiene acumulada el Órgano Ejecutivo con los cotizantes por $8,397.33 millones, cuyos fondos han servido también para pagar las pensiones del sistema antiguo.   PUEDE VER: Deuda de pensiones asciende a $8,852.7 millones hasta abrilSin embargo, tras la reforma de pensiones aprobada en diciembre de 2022 esa deuda fue canjeada o convertida a Certificados de Financiamiento de Transición (CFT) en abril de este año, pero no serán pagados a los trabajadores todavía.Por lo tanto, entre la nueva deuda y la anterior el monto se eleva a $9,010.4 millones hasta septiembre, según datos del Banco Central de Reserva (BCR).Foto EDH/ ShutterstockHasta junio pasado el saldo de los COP ascendía a $455.4 millones pero en julio subió a $507.35 millones, luego en agosto creció a $560.15 millones hasta llegar a $613.13 millones, que es el último dato disponible en el portal del BCR.   El Instituto de Pensiones ha estado emitiendo los COP sin que hasta la fecha se haga algún abono a esa deuda, según los datos oficiales.Los COP son los actuales instrumentos con los cuales el gobierno ha adquirido nuevo endeudamiento para pagar las pensiones del sistema antiguo del ISSS e Inpep (hoy ISP) y que sustituyeron a los Certificados de Inversión Previsional (CIP), tras la derogación del Fideicomiso de Obligaciones Previsionales (FOP) que existió desde 2006.La Asamblea Legislativa oficialista eliminó el FOP en diciembre de 2022 como parte de la reforma de pensiones, cuyo mecanismo sirvió a los gobiernos anteriores para tomar prestados ahorros de los trabajadores para pagar las pensiones.Al derogar el Fideicomiso, la deuda acumulada mediante los CIP se debía canjear por los nuevos Certificados de Financiamiento de Transición (CFT), lo cual se hizo en abril de este año, pero en condiciones diferentes a las acordadas originalmente y eso ocasionó que técnicamente el actual gobierno cayera en impago.   ADEMÁS: Fitch confirma que gobierno de El Salvador cayó en impago de deuda de pensionesEn abril, el gobierno ofreció tres opciones de pago de la deuda anterior de pensiones, una de ellas y que fue la elegida por las AFP era mejorar la tasa de interés al 7% a cambio de extender el vencimiento de la deuda a 50 años y dar un período de gracia de 4 años sin pagar intereses a los trabajadores que ya le prestaron el dinero al Ejecutivo para pagarle a los pensionados.Esa maniobra fiscal le ha ayudado al Ejecutivo a que en las estadísticas de la deuda pública se vea una reducción aparente.De hecho, las cifras oficiales del BCR indican que la deuda pública hasta septiembre asciende a $19,612.42 millones, pero si se le suman los $9,010.45 millones de deuda de pensiones el monto real se eleva a $28,622.87 millones.   También el más reciente informe del perfil de la deuda del Sector Público No Financiero (SPNF) de septiembre, publicado en el portal del Ministerio de Hacienda, margina de las cuentas del gobierno la deuda de pensiones.En unas breves líneas al pie del documento solo indica que a septiembre de 2023 la deuda Previsional comprende Certificados de Financiamiento de Transición (CFT) por valor de $8,397.3 millones y Certificados de Obligaciones Previsionales (COP) por $613.1 millones.Incluso, en el proyecto de presupuesto para 2024 que presentó Hacienda a la Asamblea Legislativa no han proyectado nada de fondos en concepto de costo previsional, mientras que para este año, al menos en proyección, habían programado $570 millones, pero se desconocen los detalles del uso real de ese dinero.   En el documento que resume el presupuesto para el otro año, Hacienda planteó que en relación a las pensiones “con la creación del Instituto Salvadoreño de Pensiones, el pago de las mismas pasa a su jurisdicción. Siendo el ISP una institución del sector público financiero, por tanto, no forma parte del Gobierno central y por ende no figura dentro del Presupuesto General del Estado 2024”.Hasta antes de la reforma, los fondos para el pago de las pensiones eran parte del presupuesto de Hacienda en concepto de las “Obligaciones del Estado”.Las alertas que han sonadoAnte el aumento de la deuda de pensiones, Patricio Pineda, representante y fundador de la Mesa de trabajo por una Pensión Digna, advirtió meses atrás que ellos habían hecho cálculos que la deuda del gobierno con los cotizantes sobrepasaría los $9,000 millones.“Nosotros hemos presentado un estudio actuarial desde enero (2023) con la cifra de más de $9 mil millones en deuda total y los datos del BCR cuadran con el estudio de la Mesa y con los de la Superintendencia del Sistema Financiero, porque quiere decir que (a la fecha) ya subió incluso más”, afirmó Pineda desde agosto, lo cual consideró preocupante.A su juicio, el aumento de la deuda previsional refleja la “insostenibilidad del sistema provocado por esa insistente metedera de mano que tienen los políticos que han visto en el sistema su caja chica”.    KEYWORDS  AFP   Deuda Pública   Instituto Salvadoreño De Pensiones   Negocios   Pensiones  Ver Comentarios","[' AFP ', ' Deuda Pública ', ' Instituto Salvadoreño De Pensiones ', ' Negocios ', ' Pensiones ']",https://www.elsalvador.com/noticias/negocios/gobierno-eleva-mas-de-9mil-millones-deuda-pensiones/1106099/2023/,negocios
Crecimiento en 2024 será el segundo más bajo en 10 años,"La proyección económica de EMFI para el país es que crezca apenas 1.9%, lo que está por debajo de la estimación del gobierno.",Katlen Urquilla,"Nov 23, 2023- 06:30","Si los cálculos de la agencia inglesa EMFI resultan ciertos, la economía salvadoreña podría retroceder una década el próximo año y en 2023 también sería menor a lo esperado por el gobierno.“Esperamos que la economía salvadoreña crezca un 1.9% en 2024 desde un 2.1% en 2023”, advierte la financiera en su reciente análisis sobre El Salvador.Y agrega: “Con este resultado, el crecimiento en El Salvador será el segundo más bajo en 10 años, sólo detrás del 1.7% en 2014 pero relativamente cerca del promedio del mismo período del 2.2%”.Explica que su proyección para el otro año está por debajo del pronóstico oficial de 2.4%, pero está en línea con las expectativas del Fondo Monetario Internacional (FMI) y del mercado en general. “Y está impulsada por una desaceleración de la economía estadounidense, por ejemplo, que el FMI pronostica una expansión de sólo el 1.5% desde el 2.1% este año”, indica el informe.   EMFI pronostica que el máximo crecimiento que podría alcanzar el país es del 2.6% y en el rango mínimo podría caer al 1.3%.PUEDE VER: El Salvador es el que menos crecerá en Centroamérica en 2023, según CepalMientras tanto, el Banco Central de Reserva (BCR) proyecta que la economía crecerá 2.6% en 2023.Organismos como el Banco Mundial (BM) vaticinó a inicios de octubre que el país crecerá un 2.8 % este año y 2.3 % en 2024. Y la Cepal prevé que El Salvador crezca un 2.1 % en 2023 y 1.8 % en 2024.Pero la agencia EMFI plantea que el resultado económico de El Salvador dependerá en gran medida de varios componentes externos, como el desempeño de la economía de EE.UU., fenómenos climáticos, precio del petróleo y la inflación.   “Por lo que podría ser peor de lo esperado si se materializa una recesión en EE.UU., o por el contrario, existen riesgos al alza si su economía supera”, dice el análisis.Asimismo, considera que el fenómeno de El Niño, que ha causado severas sequías en El Salvador, persistirá el próximo año, lo cual afecta negativamente al sector agrícola y añade volatilidad al escenario económico. De acuerdo a las Naciones Unidas, El Niño durará hasta mediados de 2024.Inflación y precios del petróleoAdemás, la proyección de EMFI contempla que persista la inflación y que llegue al 4% a finales de 2024. Es más, cree que oscilará entre el 3.7% y el 4.7% sobre los precios de los productos y servicios.También vaticinan que los precios del petróleo aumentarán en 2024 y que eso impacte en el país, por lo que pronostican un mayor déficit en la cuenta corriente, es decir que sean más los gastos que los ingresos, que podría oscilar entre el 2.5% y el 3.7% del PIB.   “En el frente externo, esperamos que el déficit en cuenta corriente se amplíe al 3.2% el próximo año (desde el 2.2% en 2023) debido al aumento de los precios del petróleo, la baja demanda externa y el menor crecimiento de las remesas debido a la desaceleración de la economía estadounidense”, dice EMFI.El Fondo Monetario Internacional (FMI) apuntó en su más reciente informe que la mayoría de países en el mundo verán una disminución en su ritmo de crecimiento económico para este 2023. Foto EDH / archivo    KEYWORDS  BCR   Crecimiento Económico   El Salvador   EMFI   Inflación   Negocios   Precio Del Petróleo  Ver Comentarios","[' BCR ', ' Crecimiento Económico ', ' El Salvador ', ' EMFI ', ' Inflación ', ' Negocios ', ' Precio Del Petróleo ']",https://www.elsalvador.com/noticias/negocios/crecimiento-economico-emfi-bcr-el-salvador-inflacion-precio-del-petroleo-/1105871/2023/,negocios
Antiguo Cuscatlán recibe la Navidad con su tradicional iluminación,"Antiguo Cuscatlán se convierte en esta época en el epicentro de la Navidad con sus destellantes luces, e invita a sumergirse en la magia de esta época",H. Sermeño,"Nov 26, 2023- 20:27","La magia de la temporada navideña ha llegado al corazón del parque de Antiguo Cuscatlán transformándolo en un verdadero espectáculo de luces y color.En una ceremonia llena de alegría y expectación, cientos de personas se dieron cita en el lugar para ser testigos de la inauguración de la iluminación navideña que dará vida a las noches durante la época decembrina.Te puede interesar: Moisés Urbina sube a la cima del cielo en SacacoyoEl evento fue más que un simple encender las luces; fue un momento de conexión y celebración. En el parque central, se podían observar familias enteras y grupos de amigos compartiendo entre pláticas y risas mientras el parque se preparaba para deslumbrar con su nueva apariencia navideña.   Al caer la noche, el parque se transformó en un mar de luces centelleantes. Los árboles se vistieron con brillos multicolores, creando un paisaje mágico que invitaba a pasear entre sus senderos iluminados. El complemento perfecto fueron las icónicas figuras navideñasLos asistentes disfrutaron de la decoración y del show de fuegos artificiales. Foto EDH/ Francisco RubioY ni hablar del imponente pino de Navidad colocado al centro del parque, el cual se convirtió en el escenario perfecto para un espectáculo sincronizado, dejando a los espectadores boquiabiertos.   El ya tradicional nacimiento atrajo a todos los que deseaban llevarse un recuerdo, a modo de selfi, foto familiar o reels.Lee también: Mariposario Alas y Flores, atractivo de la Ruta PanorámicaEn el discurso de apertura, la alcaldesa, Milagro Navas, destacó: “Inicia la época más bonita del año con nuestras fiestas patronales. Les invito a que compartamos nuestra cultura, arte y gastronomía que nos distinguen. Me siento contenta porque este es el esfuerzo del Comité de Festejos, es el que hace que ustedes disfruten estas fiestas. Por primera vez todas las fiestas que vamos a hacer serán gratis y vamos a tener 8 fiestas que se realizarán en diferentes partes de este municipio. Doy gracias a Dios, que me permite continuar aquí y disfruten de estas fiesta que son para ustedes”.   El parque tiene varias figuras navideñas gigantes. Entre ellas osos, renos y estrellas. Foto EDH/ Francisco RubioAdemás de dar por inauguradas las luces del parque, también se vivió un especial momento cuando el padre Gaetano Sachi hizo la bendición del Nacimiento.En el evento, la seguridad de los asistentes estuvo resguardada por un fuerte dispositivo de seguridad conformado por agentes de la PNC y miembros del CAM. Además, el equipo de Comandos de Salvamento estuvo atento a cualquier emergencia.   Los pequeñines fueron los que más disfrutaron pues tuvieron la oportunidad de entregarle su cartita a Santa Claus. Ademas se entretuvieron con la presentación del cuento “Cartas a Santa”.Show de baile previo a la llegada de Santa Claus, quien recibió las cartitas de los niños. Foto EDH/ Francisco RubioStayci Hernández llegó desde Zacamil, SanSalvador, para disfrutar junto a su familia. “Aunque no vivimos en este municipio, nuestra familia tiene la tradición de venir porque es muy bonito”, expresó.   Por su parte, Rolando Estrada, uno de los residentes del lugar, manifestó sentirse orgulloso de compartir las fiestas de su municipio con todos los salvadoreños.“Los invitamos a que se acerquen y comprueben que se respira el espíritu navideño”, exclamó.Y no cabe duda alguna, en el pueblo de Antiguo Cuscatlán, donde el aroma a pupusas nunca falta, se respira desde ya ese espíritu que tanto caracteriza a las fiestas de fin de año.Nadie se resistió a sacarse la foto del recuerdo con el imponente arbolito de Navidad, cuyas esferas ofrecen un espectáculo sincronizado de luces. Foto EDH/ Francisco RubioREGRESAR A LA PORTADA     MÁS SOBRE ESTE TEMA Toro mecánico y deportes extremos, Abigaíl Mancía disfruta del turismo nacional  Conoce las exóticas minutas de Antiguo Cuscatlán  ¿Cómo se preparan los antojitos de feria en Antiguo Cuscatlán? KEYWORDS  Antiguo Cuscatlán   Decoración Navideña   Tradiciones De Navidad   Trends   Turismo  Ver Comentarios","[' Antiguo Cuscatlán ', ' Decoración Navideña ', ' Tradiciones De Navidad ', ' Trends ', ' Turismo ']",https://www.elsalvador.com/entretenimiento/turismo/turismo-antiguo-cuscatlan-recibe-la-navidad-con-su-tradicional-iluminacion/1106701/2023/,turismo
