Titulo,Resumen,Autor,Fecha,Noticia,Keywords,URL,Categoria
Así trabajó la Selecta femenina para enfrentar a Martinica," La Selecta femenina se encuentra desde ayer en Martinica, a donde se enfrenta al equipo local este miércoles 29 en la ruta hacia Copa Oro",César Najarro / X: @cjnajarro,,"La Selecta Femenina está en su tramo final de preparación de cara al compromiso contra Martinica, en la Road to Golden Cup o Ruta hacia Copa Oro.El equipo, que está dentro de la Liga B de Naciones de la CONCACAF ya logró su boleto directo a la fase previa de la Copa Oro femenina, tras liderar su grupo con puras victorias, pero quiere cerrar con broche de oro este año con un triunfo en Martinica y otro en casa, cuando enfrente a Nicaragua el próximo 3 de diciembre.Mañana miércoles, la Femenina se enfrenta a Martinica, rival al que goleó por 9-1 en casa el pasado 24 de septiembre.El equipo arribó el lunes tras una escala en República Dominicana, a donde realizó también trabajo de recuperación y reactivación. Ayer, ya en Martinica, trabajaron en aspectos técnicos en el estadio Louis Achille.   El equipo ha estado impulsando cambios súper fuertes en la dieta y capacidad física de las chicas durante todo el año, marcando un antes y un después con hasta tres entrenos por día en algunos microciclos.En República Dominicana, se les vio así con un trabajo solo de compensación:📽| La Selecta Femenina 💪 Trabajo de compensación en República Dominicana previó al viaje a Martinica para disputar la penúltima fecha Rumbo a Copa Oro.#ElSalvador #LaSelectaFemenina pic.twitter.com/5ZuG4DJ0hW— La Selecta (@LaSelecta_SLV) November 27, 2023 Por otra parte, la Federación Salvadoreña de Fútbol recordó de nuevo acerca de las visorías que se realizarán en Estados Unidos para las selecciones femeninas Sub15 (nacidas en 2009-2011), Sub17 (2007-2009), Sub20 (2005-2007) y Mayor.   El evento será el sábado 16 de diciembre en Loudoun, Virginia, Estados Unidos, en el Loudoun Soccer Complex, ubicado en la 19798 de Sycolin Rd., Leesburg, VA 20175. Hay que inscribirse previamente a través de este enlace.MIRA TAMBIÉN: ¿Cómo quedaron los duelos de semifinales del fútbol femenino?VOLVER A PORTADA    MÁS SOBRE ESTE TEMA A apoyar a la Selecta Femenina: juega contra Nicaragua el 3 de diciembre  Gerson Pérez, exasistente de la Selecta: “Nicaragua nos pagó cosas”  El Caribe asoma para la Selecta rumbo al Mundial y la Liga de Naciones 2024  Un día como hoy la Selecta venció a Honduras en partidazo  ¿Hace cuánto la Selecta no gana en un juego? KEYWORDS  Deportes   Fútbol   Selección De Fútbol De Martinica   Selección De Fútbol Femenino De El Salvador  Ver Comentarios","[' Deportes ', ' Fútbol ', ' Selección De Fútbol De Martinica ', ' Selección De Fútbol Femenino De El Salvador ']",https://www.elsalvador.com/deportes/selecciones/futbol-seleccion-de-femenino-el-salvador-martinica/1107028/2023/,selecciones
Opinión: ¿Cómo mejorar a la Selecta si a los jugadores en Liga ni se les paga?," ¿Qué seguimiento sicológico, técnico, nutricional tienen los jugadores que una vez brillaron en liga, que son llamados a Selección, pero tras un tiempo desaparecen del mapa?",César Najarro / X: @cjnajarro,,"La Selecta ha aumentado, una vez más, su registro de más partidos sin ganar, llegó a 16 tras el empate con Curazao. Con nuevo entrenador desde hace apenas tres partidos ypocas semanas de trabajo, no es que se les pueda pedir mucho.Pero estas líneas no son ni para defender a Rubén de la Barrera (mucho menos para atacarlo), ni para defender a los jugadores o justificarlos. Es simplemente para poner los puntos sobre las íes, una vez más.Es imposible esperar resultados diferentes si se hace todo mal. En liga, se suman los jugadores de equipos de Primera División que se quejan por la falta de pagos de sus salarios. ¿Cómo pueden tener entonces las herramientas más básicas para poder siquiera ser competitivos?   Si no hay pago, es imposible seguir una dieta siquiera decente de atleta profesional. ¿O acaso en los supermercados les fiarán con decir que algún día les pagarán los directivos para comprar pescado y pechugas de pollo? ¿Con qué incentivo emocional puede llegar un jugador a entrenar si en su mente está preocupado porque él y su familia cualquier día será expulsado de la casa que paga o alquila por la falta de dinero?Aparte de todo el tema socioeconómico y la falta de capacidad para hacer mercadeable una liga decadente, está todo el problema de las canchas. El triste ejemplo del Barraza de San Miguel hace unos días era muestra de lo pobre de la liga, pobre en toda su dimensión No se pudo ni siquiera suspender el partido, que no debió de jugarse en condiciones de terreno tan lamentables. Ni había espacio para acomodarlo con el desorden que se tienen de calendario en Primera División. Eso no es fútbol lo ejecutado en esa cancha aquel día, y no se les puede pedir después a los jugadores que compitan en Selección a otro nivel cuando en las canchas nacionales no se pueden dar dos pases seguidos sin que la bola rebote como que pin pong estuvieran jugando.   ¿Qué seguimiento sicológico y humano, técnico, nutricional y de herramientas blandas para la vida tienen los jugadores que una vez brillaron medianamente en una triste liga, que son llamados a Selección para que rindan, pero tras un tiempo desaparecen del mapa?Sobran los casos de jugadores. Hugo Pérez llamó a más de 100 e intentó planes nutricionales personalizados. Muchísimos de esos convocados mostraron condiciones importantes en distintos tramos. ¿Se acuerdan del Bryan Tamacas contra Qatar en Copa Oro? ¿Por qué no podemos tener jugadores constantes? ¿Qué pasó con Jairo Henríquez, llamado a ser el desequilibrante, que bailó no una sino varias veces a jugadores de la talla de Sergiño Dest, peroluego desaparecen de Selección y no logran dar el salto a MLS? ¿Por qué ocurre todo eso?   No hay plan estratégico a largo plazo, y aunque en la FESFUT ahora hay gente que al menos intenta ciertos mínimos, como hacer cumplir los pagos, eso no bastará. Lo que ocurrirá con los jugadores de los equipos que son denunciados es que sus equipos terminarán descendiendo, inhabilitarán, en el mejor de los casos, a los directivos por un tiempo, pero su dinero no lo tendrán, y peor aún, otro equipo caerá en la quiebra y más jugadores quedarán en el limbo. Casos sobran de ejemplos en los últimos años, sino recordemos recientemente lo de Chalatenango. No hay un modelo que permita establecer mecanismos reales de equilibrio financiero, mercadeo y desarrollo a corto, mediano y largo plazo.No es Rubén de la Barrera, no era Hugo Pérez, no es Tamacas, no es Jairo, no son individuos el problema, y tampoco la solución. Albert Einstein dijo alguna vez que la locura era estar haciendo lo mismo y esperar resultados diferentes. El Salvador lleva décadas cometiendo los mismos errores, mientras otros han aprendido y han corregido. Nos estamos quedando más atrás - ahora es más claro simplemente porque otros sí están planificando a largo plazo - que naciones como Nicaragua, Honduras o Panamá, que tampoco es que hagan tantas cosas mejores, pero al menos, se han ordenado un poco más.   Se necesita gente capacitada en los puestos clave, en las direcciones deportivas, no sólo mejores entrenadores o jugadores. Ni Cristiano Ronaldo levantó al Manchester United y se terminó marchando por la puerta de atrás de un lugar a donde fue ídolo. No es el individuo. El fútbol es un sistema, y no se le puede pedir a un grupo de jugadores que lo salve cuando su contexto es tan limitado como el del fútbol salvadoreño.Es lindo imaginar casos como los de Marcelo (el brasileño ex del Real Madrid), que en medio de la pobreza continuaron luchando y cambiaron su vida y las de sus familias. Nos encantan esas historias de superación. Pero son casos aislados, y eso que en Brasil existe toda una infraestructura infinita a comparación de la de El Salvador para que se den esos jugadores excepcionales.En el fútbol actual, esperar que el talento baste no es suficiente. Afuera están planeando, trabajando, estudiando constantemente sobre dirección deportiva, mecadeo, administración de empresas, promoción de jugadores, inteligencia kinestésica aplicada, inteligencia artificial, habilidades blandas y duras... en otros países latinos a donde la corrupción ha sido también horrible como en El Salvador, los equipos han trabajado por años para tener escuelas, a donde no sólo se les enseña fútbol, sino una profesión. Al final, no todos vivirán o llegarán a ser jugadores profesionales rentables. Pero han aprendido algo en ese camino del fútbol y la vida. Mientras en El Salvador, esperamos que los seleccionados ganen mientras algunos no saben siquiera si llegarán a fin de mes...   MIRA TAMBIÉN: El peor registro de la Selecta sin ganar se sigue agrandandoVOLVER A PORTADA    MÁS SOBRE ESTE TEMA El peor registro de la Selecta sin ganar se sigue agrandando  Hugo Pérez reaparece, tras empate de la Selecta  La afición reprobó a la Selecta  La Selecta sigue en depresión tras empatar ante Curazao  Se acabó, la Selecta empató de milagro a Curazao KEYWORDS  Deportes   Fútbol   Hugo Pérez   Primera División   Rubén De La Barrera   Selecta  Ver Comentarios","[' Deportes ', ' Fútbol ', ' Hugo Pérez ', ' Primera División ', ' Rubén De La Barrera ', ' Selecta ']",https://www.elsalvador.com/deportes/selecciones/futbol-selecta-primera-division-ruben-de-la-barrera-hugo-perez/1104623/2023/,selecciones
El partido de la Selecta ante Curazao no será transmitido por TV," El amistoso que sostendrá esta tarde la Selecta ante Curazao no será transmitido por televisión, de acuerdo a lo comunicado desde el país caribeño",Josué Navarrete,,"Finalmente no habrá transmisión. Eso es lo que anunció el presentador y narrador deportivo Roberto Bundio, sobre el partido de la Selecta ante Curazao que será a las 5:00 p.m. desde el estadio Ergilio Hato de Willemstad, capital curazoleña.La Selecta busca en el Caribe el fin de la maldiciónLo explicó en la transmisión de este mediodía de Noticias 4 Visión, ""íbamos a llevar el partido de Selección Nacional, pero no se va a poder, debido a la producción de Curazao iba a realizar el partido con una sola cámara, han tenido problemas desde allí para la realización del partido"", indicó.   La decisión generará que finalmente no haya señal televisiva del encuentro, al menos, por este jueves. No ha quedado confirmado cómo quedó la situación para el segundo partido de la serie amistosa, que será el lunes a la misma hora, 6:00 p.m. para El Salvador.Primera activación de #LaSeLecta en el estadio Jean Francisca de Curazao 🇸🇻👊🔥#ElSalvador pic.twitter.com/iRHJ7NU2cs— La Selecta (@LaSelecta_SLV) November 14, 2023 En la emisión noticiosa se confirmó que los dos partidos de Primera División de este jueves sí serán transmitidos, como es el caso del Firpo-11 Deportivo a las 3:00 p.m., además del FAS-Limeño a las 7:00 p.m.REGRESAR A PORTADA       MÁS SOBRE ESTE TEMA La Selecta busca en el Caribe el fin de la maldición  Diego Gregori Díaz le hace un ""cariño"" a la Selecta  Se cae el retorno de Bryan Landaverde a la Selecta  Se vuelve viral el recuerdo de amistoso entre Chelsea FC y la Selecta  Curazao jugará ante la Selecta con 12 radicados en Países Bajos KEYWORDS  Deportes   Fútbol   Futbolistas   Selección De Fútbol De Curazao   Selecta   Televisión  Ver Comentarios","[' Deportes ', ' Fútbol ', ' Futbolistas ', ' Selección De Fútbol De Curazao ', ' Selecta ', ' Televisión ']",https://www.elsalvador.com/deportes/selecciones/amistoso-selecta-curazao-no-va-transmitido-television/1104255/2023/,selecciones
La Selecta busca en el Caribe el fin de la maldición," La Selecta jugará esta noche, el primero de dos partidos amistosos contra la Selección de Curazao. Otro chance para parar la mala racha",Franklin Ponce | X: @_FP11,,"Con miras a la eliminatoria que comenzará en junio del otro año, la Selecta de El Salvador enfrentará esta noche a Curazao, en el histórico Ergilio Hato, el cual es el primero de los dos amistosos que jugarán este escenario estos dos equipos.Una oportunidad para que el entrenador español Rubén de la Barrera se vaya familiarizando con el equipo “Azul y Blanco”, ahora con la única presión de tratar de parar la racha sin victoria de más de catorce meses.Se vuelve viral el recuerdo de amistoso entre Chelsea FC y la SelectaTanto la Selecta, como Curazao descendidos a la Liga B de Naciones de la Concacaf, tratarán de aprovechar al máximo este duelo, con miras a la próxima eliminatoria hacia el Mundial 2026.   “Lo que pretendemos es que nos ayude (el amistoso y el rival) a mejorar y a seguir yendo hacia adelante. En una situación que, por un lado, nos permitirá seguir reforzando cosas que venimos haciendo; y por otro lado, permitirnos descubrir a otros chicos que van a iniciar proceso con nosotros, gente joven que viene para ayudar y para empujar”, dijo el seleccionador cuscatleco sobre este partido.🇸🇻⚽️📹 Declaraciones de nuestro D.T Rubén de La Barrera, previo a los compromisos ante Curazao#ElSalvador pic.twitter.com/vDXuud2YhQ— La Selecta (@LaSelecta_SLV) November 16, 2023 Pocas son las variantes que podrá utilizar el seleccionador De la Barrera, en comparación al último partido que disputó contra Martinica, el mes pasado. Sin embargo, son elementos muy llamativos para reforzar al equipo en los próximos partidos.   Este será el séptimo partido entre estos dos. La Selecta está invicto ante esta selección, con cinco triunfos y un empate.REGRESAR A PORTADA    MÁS SOBRE ESTE TEMA El grueso de la Selecta de Rubén de la Barrera parte este martes rumbo a Curazao  Se cae el retorno de Bryan Landaverde a la Selecta  Se vuelve viral el recuerdo de amistoso entre Chelsea FC y la Selecta  Curazao jugará ante la Selecta con 12 radicados en Países Bajos  Se filtra supuesta convocatoria para la fecha FIFA de próxima semana de la Selecta KEYWORDS  Deportes   Fútbol   Futbolistas   Partidos Amistosos   Selección De Fútbol De Curazao   Selecta  Ver Comentarios","[' Deportes ', ' Fútbol ', ' Futbolistas ', ' Partidos Amistosos ', ' Selección De Fútbol De Curazao ', ' Selecta ']",https://www.elsalvador.com/deportes/selecciones/selecta-previa-primer-amistoso-curazao-fecha-fifa-noviembre/1104108/2023/,selecciones
Justicia atrancada,No se encontró resumen,No se encontró autor,No se encontró fecha,KEYWORDS  Caricatura De Alecus   Caricaturas   Opinión ,"[' Caricatura De Alecus ', ' Caricaturas ', ' Opinión ']",https://www.elsalvador.com/opinion/caricaturas/alecus/caricatura-de-alecus-caricaturas-/1106955/2023/,caricaturas
La pesadilla del Croc,No se encontró resumen,No se encontró autor,No se encontró fecha,KEYWORDS  Caricatura De Alecus   Caricaturas   Opinión ,"[' Caricatura De Alecus ', ' Caricaturas ', ' Opinión ']",https://www.elsalvador.com/opinion/caricaturas/alecus/caricatura-de-alecus-caricaturas-/1106767/2023/,caricaturas
La Asamblea,No se encontró resumen,No se encontró autor,No se encontró fecha,KEYWORDS  Caricatura De Alecus   Caricaturas   Opinión ,"[' Caricatura De Alecus ', ' Caricaturas ', ' Opinión ']",https://www.elsalvador.com/opinion/caricaturas/alecus/caricatura-de-alecus-caricaturas-/1106108/2023/,caricaturas
Pinochos,No se encontró resumen,No se encontró autor,No se encontró fecha,KEYWORDS  Bukelismo   Caricatura De Alecus   Opinión   Pandillas   Regimen De Excepción ,"[' Bukelismo ', ' Caricatura De Alecus ', ' Opinión ', ' Pandillas ', ' Regimen De Excepción ']",https://www.elsalvador.com/opinion/caricaturas/alecus/caricatura-de-alecus-negociaciones-pandillas/1105605/2023/,caricaturas
El contribuyente,No se encontró resumen,No se encontró autor,No se encontró fecha,KEYWORDS  Caricatura De Alecus   Miss Universo   Opinión ,"[' Caricatura De Alecus ', ' Miss Universo ', ' Opinión ']",https://www.elsalvador.com/opinion/caricaturas/alecus/caricatura-de-alecus-miss-universo/1105293/2023/,caricaturas
Otro reinado,No se encontró resumen,No se encontró autor,No se encontró fecha,KEYWORDS  Caricatura De Alecus   Daniel Ortega   Miss Universo   Opinión ,"[' Caricatura De Alecus ', ' Daniel Ortega ', ' Miss Universo ', ' Opinión ']",https://www.elsalvador.com/opinion/caricaturas/alecus/miss-universo-caricatura-de-alecus-daniel-ortega/1105200/2023/,caricaturas
Antiinmigrante,No se encontró resumen,No se encontró autor,No se encontró fecha,KEYWORDS  Caricatura De Alecus   Inmigrantes   Migrantes   Opinión ,"[' Caricatura De Alecus ', ' Inmigrantes ', ' Migrantes ', ' Opinión ']",https://www.elsalvador.com/opinion/caricaturas/alecus/inmigrantes-migrantes-caricatura-de-alecus/1104467/2023/,caricaturas
El príncipe de la cenicienta,No se encontró resumen,No se encontró autor,No se encontró fecha,KEYWORDS  Caricatura De Alecus   Dirección De Centros Penales   Opinión ,"[' Caricatura De Alecus ', ' Dirección De Centros Penales ', ' Opinión ']",https://www.elsalvador.com/opinion/caricaturas/alecus/caricatura-de-alecus-crook-pandillero/1104128/2023/,caricaturas
Protesta contra la tala,No se encontró resumen,No se encontró autor,No se encontró fecha,KEYWORDS  Caricatura De Alecus   Medio Ambiente   Opinión ,"[' Caricatura De Alecus ', ' Medio Ambiente ', ' Opinión ']",https://www.elsalvador.com/opinion/caricaturas/alecus/protesta-contra-la-tala-caricatura-alecus/1103869/2023/,caricaturas
Una piedra en el camino,No se encontró resumen,No se encontró autor,No se encontró fecha,KEYWORDS  Caricatura De Alecus   Opinión ,"[' Caricatura De Alecus ', ' Opinión ']",https://www.elsalvador.com/opinion/caricaturas/alecus/una-piedra-en-el-camino-alecus/1103595/2023/,caricaturas
Carta a la gente en Soyapango y otros barrios: ¿Hasta cuándo van a callarse?,.,No se encontró autor,, Por Paolo LuersPeriodista ,"[' Las Cartas De Paolo Lüers ', ' Opinión ']",https://www.elsalvador.com/opinion/cartas-de-paolo/las-cartas-de-paolo-luers-/1106878/2023/,cartas-de-paolo
Carta al Tribunal Antiético y su angelito Osiris Luna,"Ya es la segunda vez que el TAG se niega a proceder contra Osiris. La primera vez fue cuando salieron fotos de Osiris y su acompañante, sentados en un jet privado viajando por México.",No se encontró autor,, Por Paolo LuersPeriodista ,"[' Internacional ', ' Las Cartas De Paolo Lüers ']",https://www.elsalvador.com/opinion/cartas-de-paolo/las-cartas-de-paolo-luers-/1106325/2023/,cartas-de-paolo
Carta a quienes celebran el triunfo de Milei en Argentina,"Que las derechas conservadoras y liberales no entiendan esto, demuestra qué mal está este centro político. Parece aterrorizado por la “ola roja”, que piensan que va a arrasar con América Latina. Esto ciega a la derecha y no la deja ver que las dictaduras de izquierda históricas en Cuba, Venezuela y Nicaragua son aisladas y agonizantes y ya no entusiasman a nadie.",No se encontró autor,, Por Paolo LuersPeriodista ,"[' Las Cartas De Paolo Lüers ', ' Opinión ']",https://www.elsalvador.com/opinion/cartas-de-paolo/las-cartas-de-paolo-luers-/1105313/2023/,cartas-de-paolo
Carta sobre el parque de diversiones que llaman Biblioteca Nacional,"Lo que querían construir fue una atracción turística, una especie de parque de diversiones, algo muy visible, muy moderno, muy cool. No digo que es mala idea tener una atracción de este tipo. Pero tiene razón Cañas Dinarte: no es una Biblioteca Nacional.",No se encontró autor,, Por Paolo LuersPeriodista ,"[' Bibliotecas Públicas ', ' BINAES ', ' Opinión ']",https://www.elsalvador.com/opinion/cartas-de-paolo/bibliotecas-publicas-binaes-/1104592/2023/,cartas-de-paolo
"Carta-cuento: La tailandesa y el guanaco, la pareja perfecta","Al final la señora tailandesa habrá salido bien del proceso de bancarrota de su empresa, habrá pagado sus créditos y saldrá adelante. Mientras tanto, el presidente de El Salvador tendrá su gran show, será personaje internacional por unos días – y presidente por 5 años más. Este es el deal.",No se encontró autor,, Por Paolo LuersPeriodista ,"[' Las Cartas De Paolo Lüers ', ' Opinión ']",https://www.elsalvador.com/opinion/cartas-de-paolo/las-cartas-de-paolo-luers-/1103917/2023/,cartas-de-paolo
Carta sobre la caja de trucos para garantizar el triunfo oficialista,"Y si son tan seguros de su inmenso apoyo popular, ¿por qué razón tenían que gastar millones de dólares para traer a El Salvador, justo cuando arranca la campaña, el concurso Miss Universo con un programa de tres semanas de espectáculos? Y además sacaron de su caja de trucos el más burdo de todos: Pusieron a la misses -a las que se que se dejaron- cachuchas con las letras “BUKELE 2024” y una segunda línea que altera el lema nacional: Ahora es “Dios, Unión, Libertad, Bitcoin"".",No se encontró autor,, Por Paolo LuersPeriodista ,"[' Las Cartas De Paolo Lüers ', ' Opinión ']",https://www.elsalvador.com/opinion/cartas-de-paolo/las-cartas-de-paolo-luers-/1103415/2023/,cartas-de-paolo
Carta sobre cómo se llega del concepto “circo y pan” a “show y hambre”,"Circo sin pan ya es una decepción, una perversión del viejo lema ‘Panem et circenses”. Pero espectáculo con hambre es una política inhumana, ofensiva y humillante. Sólo en un país que se siente feliz ser gobernado por una agencia de publicidad especializada en espectáculos, la gente acepta esta fórmula de ‘Espectáculo y hambre’.",No se encontró autor,, Por Paolo LuersPeriodista ,"[' Las Cartas De Paolo Lüers ', ' Opinión ']",https://www.elsalvador.com/opinion/cartas-de-paolo/las-cartas-de-paolo-luers-/1102821/2023/,cartas-de-paolo
"Carta a los gobernantes, los actuales y los futuros: Tareas por hacer","Es un catálogo largo de tareas complicadas -y ni siquiera es completo. No incluye las necesidades de inversión en Educación, Salud y Vivienda. Esta lista de prioridades ilustra el crítico estado en que está el país, consecuencia de cuatro gobiernos incompetentes y corruptos, comenzando con el de Tony Saca, pasando por los dos del FMLN, e incluyendo el actual de Nuevas Ideas.",No se encontró autor,, Por Paolo LuersPeriodista ,"[' Las Cartas De Paolo Lüers ', ' Opinión ']",https://www.elsalvador.com/opinion/cartas-de-paolo/las-cartas-de-paolo-luers-/1102315/2023/,cartas-de-paolo
Carta a los doce conspiradores contra la Constitución,No se encontró resumen,No se encontró autor,, Por Paolo LuersPeriodista ,"[' Elecciones 2024 ', ' Las Cartas De Paolo Lüers ', ' Nayib Bukele ', ' Opinión ', ' Paolo Lüers ', ' TSE ']",https://www.elsalvador.com/opinion/cartas-de-paolo/paolo-luers-las-cartas-de-nayib-bukele-tse-elecciones-2024/1101805/2023/,cartas-de-paolo
Carta a los expertos en Washington: ¿Ninguna línea roja?,"No hay que esperar que Estados Unidos enfrente la bestia. Lo tenemos que hacer nosotros mismos. Y si lo hacemos, de la manera como lo están haciendo los guatemaltecos, hasta desde Washington nos van a ayudar.",No se encontró autor,, Por Paolo LuersPeriodista ,"[' Las Cartas De Paolo Lüers ', ' Opinión ']",https://www.elsalvador.com/opinion/cartas-de-paolo/las-cartas-de-paolo-luers-/1100780/2023/,cartas-de-paolo
¿Cómo va la campaña…?,"Más allá de estos supuestos e hipótesis debemos incluir en el análisis otras rutas críticas del trabajo territorial que realizan los partidos, iniciativas locales y comunitarias y el impacto que pueda tener la gestión ineficiente de algunas municipalidades; aspectos que podrían tener alguna incidencia en las conductas de los electores.",No se encontró autor,, Por Óscar Picardo Joao ,"[' Elecciones El Salvador ', ' Opinión ']",https://www.elsalvador.com/opinion/editoriales/elecciones-el-salvador-/1106961/2023/,editoriales
¿Es Javier Milei el Donald Trump argentino?,"Javier Milei no tiene la misma línea política de Trump, quien fue un presidente derechista, mercantilista, que al final maneja un enfoque más diverso con políticas que podemos catalogar como más liberales y otras antiliberales e incluso con un pincelazo peronista.",No se encontró autor,, Por Luis José Samayoa RodríguezAbogado ,"[' Argentina ', ' Opinión ']",https://www.elsalvador.com/opinion/editoriales/argentina-/1106960/2023/,editoriales
